{"image": "iVBORw0KGgoAAAANSUhEUgAAAAUAAAAFCAYAAACNbyblAAAAHElEQVQI12P4//8/w38GIAXDIBKE0DHxgljNBAAO9TXL0Y4OHwAAAABJRU5ErkJggg==", "thumb": "iVBORw0KGgoAAAANSUhEUgAAAAUAAAAFCAYAAACNbyblAAAAHElEQVQI12P4//8/w38GIAXDIBKE0DHxgljNBAAO9TXL0Y4OHwAAAABJRU5ErkJggg==", "is_aadhar_card": true, "aadhar_number": "461067596799", "is_pan_card": false, "pan_number": "", "entities": {"address": ["PSC 4183, Box 0675\nAPO AE 60200", "07408 Jerry Trail\nHunterville, NE 74689"], "email": ["amyvelazquez@gmail.com", "janice55@gmail.com"], "phone": ["249.269.4711x80132", "4075227586"], "url": ["http://www.bauer.com/", "https://www.nichols-george.info/"], "date": ["1996-06-10", "2011-05-03", "2009-11-26", "1985-11-23", "1971-05-25"], "money": ["\u060b24.89", "\u20aa51.74"], "tracking": ["OttiWmLrWz", "zSLJhZvFuc", "ObFgqKHkOO", "TFyGrgJGPg"]}, "englishText": " Knowledge wind. 461067596799   PSC 4183, Box 0675\nAPO AE 60200 Would book just at. 07408 Jerry Trail\nHunterville, NE 74689 Just staff clearly. amyvelazquez@gmail.com Allow strong likely. janice55@gmail.com Rich key all model. 249.269.4711x80132 Treat garden seven. 4075227586 Bar he avoid. http://www.bauer.com/ Her role all hair. https://www.nichols-george.info/ Could action then. 1996-06-10 Tell history avoid. 2011-05-03 Walk character. 2009-11-26 About democratic. 1985-11-23 Report sign writer. 1971-05-25 Candidate small. \u060b24.89 Finally home road. \u20aa51.74 Worker point early. OttiWmLrWz Change culture long. zSLJhZvFuc Me guy second. ObFgqKHkOO Case ahead detail. TFyGrgJGPg Government material.", "hindiText": " Knowledge wind. 461067596799   PSC 4183, Box 0675\nAPO AE 60200 Would book just at. 07408 Jerry Trail\nHunterville, NE 74689 Just staff clearly. amyvelazquez@gmail.com Allow strong likely. janice55@gmail.com Rich key all model. 249.269.4711x80132 Treat garden seven. 4075227586 Bar he avoid. http://www.bauer.com/ Her role all hair. https://www.nichols-george.info/ Could action then. 1996-06-10 Tell history avoid. 2011-05-03 Walk character. 2009-11-26 About democratic. 1985-11-23 Report sign writer. 1971-05-25 Candidate small. \u060b24.89 Finally home road. \u20aa51.74 Worker point early. OttiWmLrWz Change culture long. zSLJhZvFuc Me guy second. ObFgqKHkOO Case ahead detail. TFyGrgJGPg Government material."}